{
  "version": 1,
  "sha256": "3f9f2f14202434336803f975dddd6221d51ea3a14b5c5b169f50d2dc850311b6",
  "types": [],
  "functions": [
    {
      "address": "0x1af18",
      "name": "WdogFeederThread",
      "plate_comment": "Recovered Thumb pthread callback: launcher 0x1ac08 passes 0x1af19; EHABI starts 0x1af18, next 0x1af6c. Logs time, flushes stdout, calls unresolved 0x1abd8 then 0x1ad68, sets word 0x345ec=1, calls 0x1aec8 then sleep(8) until that word is zero, calls 0x1ac20 and returns zero. Calls alone do not establish watchdog acceptance, map-writer quiescence, MCU behavior or persistence durability. No callback ABI signature imposed.",
      "expect": {
        "name": "FUN_0001af18",
        "plate_comment": null
      }
    }
  ]
}
